{
  "case_name": "Meridian Retail Group \u2014 Supplier Invoice Dispute Transformation",
  "executive_summary": [
    {
      "statement": "Meridian's dispute process is a multi-system exception workflow in which AP analysts must reconstruct facts from SAP, Coupa, Outlook, SharePoint, receiving/logistics records, and supplier-specific commercial terms before determining a disposition.",
      "evidence_type": "DIRECT",
      "confidence": 0.99,
      "evidence_refs": [
        "DOC:01_AP_Dispute_Resolution_SOP.md",
        "DOC:02_Vendor_Commercial_Terms_Policy.md"
      ]
    },
    {
      "statement": "Historical performance is weak relative to stated service levels: the analyzed dataset shows 62% SLA attainment, 6.8 business days average resolution time, and a 14% reopen rate.",
      "evidence_type": "DERIVED",
      "confidence": 1.0,
      "evidence_refs": [
        "QUANT:overall"
      ]
    },
    {
      "statement": "Missing evidence is strongly associated with poorer operating outcomes: cases marked as missing evidence achieved 13.3% SLA attainment versus 68.6% without missing evidence.",
      "evidence_type": "DERIVED",
      "confidence": 1.0,
      "evidence_refs": [
        "QUANT:missing_evidence_impact"
      ]
    },
    {
      "statement": "Supplier-specific terms materially change otherwise standard AP decisions, creating a recurring need to identify the correct governing document before resolving price, freight, dispute-window, quantity, and service cases.",
      "evidence_type": "DIRECT",
      "confidence": 0.98,
      "evidence_refs": [
        "DOC:03_NorthStar_Agreements.md",
        "DOC:04_Apex_Agreement.md",
        "DOC:05_Solara_Agreements_and_Email.md"
      ]
    },
    {
      "statement": "A material part of operational complexity appears to arise from evidence retrieval, interpretation, and handoffs rather than from the arithmetic of invoice matching alone.",
      "evidence_type": "INFERRED",
      "confidence": 0.87,
      "evidence_refs": [
        "DOC:01_AP_Dispute_Resolution_SOP.md",
        "QUANT:system_complexity_bands",
        "QUANT:missing_evidence_impact"
      ]
    }
  ],
  "process_steps": [
    {
      "step_id": "P1",
      "process_step": "Invoice validation and exception creation",
      "actor": [
        "SAP / AP automation"
      ],
      "trigger": "Invoice enters Meridian AP processing and fails standard automated validation.",
      "inputs": [
        "Supplier invoice",
        "Purchase order",
        "Goods receipt where applicable"
      ],
      "systems_used": [
        "SAP S/4HANA"
      ],
      "activity": "Create an invoice exception and assign a reason code when sufficient information is available.",
      "decision_required": "Whether the invoice can process automatically or requires exception handling.",
      "outputs": [
        "Invoice exception",
        "System reason code"
      ],
      "handoffs": [
        "AP Analyst"
      ],
      "policy_constraints": [
        "Reason code must be validated by the assigned analyst."
      ],
      "approval_required": "None at intake.",
      "failure_modes": [
        "Incorrect reason-code assignment",
        "Overuse of OTHER",
        "Incomplete intake context"
      ],
      "evidence_refs": [
        "DOC:01_AP_Dispute_Resolution_SOP.md"
      ]
    },
    {
      "step_id": "P2",
      "process_step": "Reason-code verification and evidence collection",
      "actor": [
        "AP Analyst"
      ],
      "trigger": "Exception assigned to analyst.",
      "inputs": [
        "Invoice exception",
        "Invoice",
        "PO",
        "Goods receipt",
        "Supplier documentation",
        "Commercial agreements"
      ],
      "systems_used": [
        "SAP",
        "Coupa",
        "SharePoint",
        "Outlook",
        "TMS",
        "Receiving records as applicable"
      ],
      "activity": "Verify the actual issue and assemble the factual and commercial evidence needed to resolve it.",
      "decision_required": "Whether available evidence is sufficient and which additional sources or stakeholders are required.",
      "outputs": [
        "Evidence set",
        "Confirmed or revised issue framing"
      ],
      "handoffs": [
        "Supplier",
        "Procurement",
        "Receiving",
        "Logistics",
        "Tax"
      ],
      "policy_constraints": [
        "Analyst should avoid requesting evidence already available internally.",
        "Supplier-specific executed terms can override generic policy."
      ],
      "approval_required": "None solely for evidence collection.",
      "failure_modes": [
        "Missing evidence",
        "Searching multiple repositories",
        "Outdated or conflicting documents",
        "Weak historical notes"
      ],
      "evidence_refs": [
        "DOC:01_AP_Dispute_Resolution_SOP.md",
        "DOC:02_Vendor_Commercial_Terms_Policy.md"
      ]
    },
    {
      "step_id": "P3",
      "process_step": "Root-cause and policy determination",
      "actor": [
        "AP Analyst"
      ],
      "trigger": "Relevant evidence has been assembled.",
      "inputs": [
        "Transaction records",
        "Supplier evidence",
        "Generic AP policy",
        "Supplier-specific contracts/amendments"
      ],
      "systems_used": [
        "SAP",
        "SharePoint",
        "Outlook",
        "TMS as applicable"
      ],
      "activity": "Determine the cause of the discrepancy and identify the commercial or procedural rule that governs the case.",
      "decision_required": "Which policy or supplier-specific term governs and whether the case is sufficiently clear to resolve.",
      "outputs": [
        "Root-cause determination",
        "Applicable policy/contract interpretation"
      ],
      "handoffs": [
        "Procurement",
        "Tax",
        "Logistics",
        "Receiving"
      ],
      "policy_constraints": [
        "Document precedence applies.",
        "Informal email and historical treatment are not automatically authoritative."
      ],
      "approval_required": "Specialist review where policy requires it.",
      "failure_modes": [
        "Ambiguous contract language",
        "Conflicting amendments",
        "Reliance on precedent without validating current terms",
        "Incorrect interpretation"
      ],
      "evidence_refs": [
        "DOC:02_Vendor_Commercial_Terms_Policy.md",
        "DOC:03_NorthStar_Agreements.md",
        "DOC:04_Apex_Agreement.md",
        "DOC:05_Solara_Agreements_and_Email.md"
      ]
    },
    {
      "step_id": "P4",
      "process_step": "Request additional information or escalate",
      "actor": [
        "AP Analyst",
        "Procurement",
        "Receiving",
        "Logistics",
        "Tax",
        "Supplier"
      ],
      "trigger": "Evidence is incomplete, authority is insufficient, or interpretation is ambiguous.",
      "inputs": [
        "Current case summary",
        "Known evidence",
        "Specific unresolved question"
      ],
      "systems_used": [
        "Outlook",
        "Coupa",
        "SharePoint",
        "SAP"
      ],
      "activity": "Request missing information or route the case to the function with authority to resolve the ambiguity.",
      "decision_required": "Who owns the unresolved question and whether the case should remain pending or be escalated.",
      "outputs": [
        "Additional evidence",
        "Functional decision",
        "Escalation response"
      ],
      "handoffs": [
        "AP Analyst"
      ],
      "policy_constraints": [
        "Cases awaiting evidence remain PENDING INFORMATION.",
        "Escalation should state the evidence and specific decision required."
      ],
      "approval_required": "Depends on subject matter and disputed amount.",
      "failure_modes": [
        "Slow follow-up",
        "Poorly structured escalation",
        "Escalation because a case is time-consuming rather than truly ambiguous",
        "External waiting time"
      ],
      "evidence_refs": [
        "DOC:01_AP_Dispute_Resolution_SOP.md",
        "CASE:MRG-2026-0026",
        "CASE:MRG-2026-0184",
        "CASE:MRG-2026-0147"
      ]
    },
    {
      "step_id": "P5",
      "process_step": "Resolution and approval",
      "actor": [
        "AP Analyst",
        "AP Team Lead",
        "AP Manager",
        "Finance Director",
        "Procurement where required"
      ],
      "trigger": "Evidence and governing rule are sufficient to make a disposition.",
      "inputs": [
        "Resolution recommendation",
        "Disputed amount",
        "Supporting evidence",
        "Required specialist input"
      ],
      "systems_used": [
        "SAP",
        "Email / Coupa for approval evidence"
      ],
      "activity": "Select the resolution disposition and obtain required approval according to disputed amount and policy.",
      "decision_required": "PAY_AS_INVOICED, PAY_PO_AMOUNT, PARTIAL_ADJUSTMENT, REQUEST_CREDIT_NOTE, REJECT_DISPUTE, or ESCALATE.",
      "outputs": [
        "Approved disposition"
      ],
      "handoffs": [
        "AP Analyst for execution"
      ],
      "policy_constraints": [
        "Approval authority is based on original disputed amount.",
        "Certain strategic-supplier situations require Procurement consultation."
      ],
      "approval_required": "< $10k analyst; $10k\u2013$50k team lead; $50k\u2013$250k AP manager; > $250k Finance Director.",
      "failure_modes": [
        "Incorrect disposition",
        "Missing approval",
        "Failure to decompose mixed invoices",
        "Unsupported exception"
      ],
      "evidence_refs": [